{
  "schema": 1,
  "phase": "model",
  "substrate": "model_brep",
  "labels": ["body"],
  "physical_groups": ["Body"],
  "unnamed": [],
  "evidence": [
    {
      "substrate": "model_brep",
      "dim": 3,
      "key": 1,
      "labels": ["body"],
      "physical_groups": ["Body"],
      "bbox": [0.0, 0.0, 0.0, 1.0, 1.0, 1.0]
    }
  ],
  "bbox": [0.0, 0.0, 0.0, 1.0, 1.0, 1.0],
  "active_group": null
}
